"7af61f2032c22d5c22011d40f6892ec9","楝叶吴萸","楝叶吴萸（学名：Evodia glabrifolia (Champ. ex Benth.) Huang）是芸香科吴茱萸属植物，树高达20米，胸径80厘米。树皮灰白色，不开裂，密生圆或扁圆形、略凸起的皮孔。叶有小叶7-11片，很少5片或更多，小叶斜卵状披针形，少有更大的，两则明显不对称。花序顶生，花甚多；萼片及花瓣均5片，很少同时有4片的；种子长约4毫米，宽约3.5毫米，褐黑色。花期7-9月，果期10-12月。分布于中国（台湾、福建、广东、海南、贵州、江西、广西及云南南部）、越南、菲律宾等国家；约北纬24°以南地区。生长于海拔500米至800米的地区，多生于平地常绿阔叶林中及山谷较湿润地方常成为主要树种。木材有酸辣气味，无虫蛀，较耐腐。是天花板、楼板、门窗、枪托、车、船内装饰及文具等用材。在广州历来的商品材“檫木”即是根种，它与森树（或称苦楝）同入良材之列。树叶是蓖麻蚕的良好饲料。含柠檬苦素类似物（limonoids）及醌类化合物大黄素-甲醚（physcion）；根皮可能含小檗碱。种子含油26.27%。根及果用作草药，有健胃、驱风、镇痛、消肿之功效。在中国广东西南部一些地区为营造速生杂木林及“四边地”的主要树种之一。（概述图参考来源： ）"
"7b13ec3e3478c81847f88ddbdaf543c0","金桔","金桔（拉丁学名：Fortunella margarita (Lour. ) Swingle），是芸香科金柑属下的植物，又称金枣、金柑、小橘子。原分布中国东南沿海各省，特别是广东地区，种植和食用金柑的历史最悠久，是名副其实的金桔之乡。另外华南及长江中下游也广为栽培。金桔为常绿灌木。高3米，一般不具刺，小枝绿色，营养充足时分枝多；叶披针形至长椭圆形，5-9厘米长，全缘，叶柄稍有翅；花小，白色，芳香，1-3朵腋生，花瓣5，雄蕊20-25，子房5室；果椭圆形或倒卵形，长2.5-3.5厘米，金黄色；果实球形的属日本金桔(F.japonica)。赏其叶花、果，或专为生产果实制作桔饼者，盆栽后精细管理，繁殖用嫁接法，砧木用枸桔或柑桔类实生苗。一株可以结10个以上的金黄小桔，新春佳节一般出口香港地区，很受香港人欢迎。"
"7b146759d5701f20de48782ce5381447","白菜","白菜（学名：Brassica pekinensis (Lour.) Rupr. ）是十字花科，芸苔属二年生草本，高可达60厘米，全株无毛，基生叶多数，大形，倒卵状长圆形至宽倒卵形，顶端圆钝，边缘皱缩，波状，叶柄白色，扁平，花鲜黄色，萼片长圆形或卵状披针形，直立，淡绿色至黄色；花瓣倒卵形，果梗开展或上升，种子球形，棕色。5月开花，6月结果。 白菜原分布于中国华北，中国各地广泛栽培。白菜比较耐寒，喜好冷凉气候，不适于栽植在排水不良的粘土地上。 白菜营养丰富，菜叶可供炒食、生食、盐腌、酱渍，外层脱落的菜叶尚可作饲料， 具有一定的药用价值。 （概述图参考来源：中国自然标本馆 ）"
"7b1510761a06112fe2e8179ec0316329","内稃","内稃Palea，Palet，直接包被着禾本科（Gramineae）花的稃。隔着外稃与花的主体相对，不具主脉，有二，其背对向小穗的轴。"
"7b1e84176d2693fca4823375a25524e5","小青瓜","小青瓜即荷兰瓜，也叫荷兰小黄瓜。属水果型黄瓜，正常瓜型长13cm左右，重30克左右，瓜质青绿色、光亮，瓜肉嫩、脆、甜，专供城市超市柜台，是时下最流行的鲜食黄瓜。"
"7b2855f00413afc3328dec94c924902b","非洲菠萝格","非洲菠萝格,原名：格木、别名：斗登风、孤坟柴、赤叶柴，拉丁文名：Erythrophleum fordii Oliv. 豆科、格木属乔木，嫩枝和幼芽被铁锈色短柔毛。叶互生，二回羽状复叶，无毛；羽片通常3对，对生或近对生，厚革质，有网脉；种子长圆形，稍扁平，种皮黑褐色。花期5-6月；生于山地密林或疏林中。其木材材性光泽强，纹理交错；结构中，甚重硬，强度高。广泛适用于重型建筑、耐久性用材、桥梁、港口和码头用材、枕木、重载地板、车辆、鱼船、工具柄等。图片均取自中国植物图库"
"7b2e9225990638e0f25f514e49749993","单作","单作（sole cropping）指在同一块田地上种植一种作物的种植方式，也称为纯种、清种、净种。"
"7b47fe8f7a814ddc524d373de3a91730","蒙自石榴","蒙自石榴，云南省红河哈尼族彝族自治州蒙自市特产，全国农产品地理标志。石榴，原产波斯（伊朗）一带，约在西汉时传入中国。其名分别有丹若、沃丹、金罂、安石榴等。据说：汉代张骞出使西域，从涂林安石国得种归来种植栽培，故唐代元稹有“何年安石国，万里贡榴花，迢递河源道，因依汉使槎”之诗句，石榴也因此名为安石榴。蒙自石榴大约有70多个品种，分为观赏和食用两大类。食用石榴营养丰富，含有多种人体所需的营养成分，果实中含有维生素C及B族维生素，有机酸、糖类、蛋白质、脂肪，以及钙、磷、钾等矿物质。蒙自甜石榴在当地果农的长期栽培实践中，培育出甜绿子、甜沙子、甜白花等3个优质品种。其中，以甜绿子为最优，其个头大如碗，籽实饱满，肉厚核小，晶莹如珠，汁多蜜甜。绿子石榴和沙子石榴同是农历七八月间成熟。白花石榴的成熟期稍晚一些，大约农历八九月间成熟。2010年03月25日，原中华人民共和国农业部批准对“蒙自石榴”实施农产品地理标志登记保护。"
"7b80e035f077c965bf864ad3df39ffc4","传统泡菜","泡菜，是一道地地道道的中国料理，口味美好，又有营养。 古称葅，是指为了利于长时间存放而经过发酵的蔬菜。一般来说，只要是纤维丰富的蔬菜或水果，都可以被制成泡菜。泡菜含有丰富的维生素和钙、磷等无机物，既能为人体提供充足的营养，又能预防动脉硬化等疾病。"
"7b89013504825268092fccfc74d37ee0","铁岭大葱","铁岭大葱已有上百年的种植历史。 铁岭大葱已有上百年的种植历史。 铁岭大葱已有上百年的种植历史。"
"7b8c0dbe3047308b21c6d8ecbcce8c61","大棚大根","大棚大根是由兴农种子（北京）有限公司1981年育成的品种，区试平均亩产5173公斤，适宜北京平原地区春季栽培，在海拔600米以上地区，初夏也可播种。"
"7b8c6f0b8ed5320928b3ae591b05326c","小苣苔","[学名]Gesnesia cuneifolia[科属]苦苣苔科小苣苔属。原产古巴至波多黎各。不耐寒，越冬最低温度为12℃，夏季宜遮荫。喜排水良好、富含有机质的疏松土壤。株高约30cm，叶互生，倒披针状楔形，叶面光滑，具泡状隆起。花单生，花梗绿或红色。花冠筒渐弯呈弧形，长3cm，黄至红色，径1.5cm。播种或扦插法繁殖。用于温室盆栽观赏。"
"7b8e06ce95de5a557ac026ce2e04f3a4","不丹紫堇","不丹紫堇（学名：Corydalis dorjii D. G. Long）是罂粟科紫堇属植物。多年生草本，须根多数，茎直立，叶片轮廓宽三角形，总状花序顶生，花梗纤细，花瓣淡蓝色、淡紫色或紫红色，子房狭椭圆形，花柱短，柱头扁长方形，蒴果（未成熟）狭扁椭圆形，花果期4-5月前后。"
"7b9ca7f3fa5f576e0b3c0a47621d75e2","台湾杜鹃","台湾杜鹃属常绿阔叶乔木，树干多但无明显分叉。产地以台湾中部山区，尤其是阿里山的数量居冠。"
"7b9f9cab9f655cd75d5bf6bc675b39c5","朱桔","八岭山朱橘，湖北省荆州市荆州区特产，中国国家地理标志产品。朱橘在荆州种植历史悠久，春秋战国时期就在楚都江陵一带大量种植，爱国诗人屈原的一首《橘颂》让朱橘名满天下。盛唐时期，著名诗人杜甫、白居易、杜牧、元稹、杨衡等都对朱橘大加赞扬。到了宋代，朱橘成为朝廷贡品。改革开放以来，政府加大了对朱橘这种具有地方特色农产品的保护力度，引导广大农民使用有机肥，采用生物防虫和物理防虫的方法，保持了朱橘的原生态生长要求，稳定了该品种的遗传特性，使其优良品质得到了传承和巩固。2014年04月09日，原国家质检总局批准对“八岭山朱橘”实施地理标志产品保护。"
"7ba520d4479fb13cf022a6959549136f","化学治疗","化疗是化学药物治疗的简称，是利用化学药物阻止癌细胞的增殖、浸润、转移，直至最终杀灭癌细胞的一种治疗方式。它是一种全身性治疗手段，和手术、放疗一起，并称为癌症的3大治疗手段。"
"7ba9fb4e665cde7bda8d747e8c471b40","莴苣叶","莴苣叶，菊科，莴苣属。可食用。莴苣叶中含有的营养价值甚至高于茎的价值。"
"7bb05a085d2b3ed6b47c893033ba5e17","三花莸","三花莸（Caryopteris terniflora Maxim.）：又名野荆芥、黄刺泡、大风寒草、蜂子草、六月寒、金线风、风寒草，为马鞭草科、莸属直立亚灌木，常自基部即分枝，高15-60厘米；茎方形，密生灰白色向下弯曲柔毛。叶片纸质，卵圆形至长卵形，长1.5-4厘米，宽1-3厘米，顶端尖，基部阔楔形至圆形，两面具柔毛和腺点，以背面较密，边缘具规则钝齿，侧脉3-6对；叶柄长0.2-1.5厘米，被柔毛。聚伞花序腋生，花序梗长1-3厘米，通常3花，偶有1或5花，花柄长3-6毫米；苞片细小，锥形；花萼钟状，长8-9毫米，两面有柔毛和腺点，5裂，裂片披针形；花冠紫红色或淡红色，长1.1-1.8厘米，外面疏被柔毛和腺点，顶端5裂，二唇形，裂片全缘，下唇中裂片较大，圆形；雄蕊4枚，与花柱均伸出花冠管外；子房顶端被柔毛，花柱长过雄蕊。蒴果成熟后四瓣裂，果瓣倒卵状舟形，无翅，表面明显凹凸成网纹，密被糙毛。花果期6-9月。全草药用，有解表散寒，宣肺之效。治外感头痛、咳嗽、外障目翳、烫伤等症。分布于中国河北、山西、陕西、甘肃、江西、湖北、四川、云南。生于海拔550-2600米的山坡、平地或水沟河边。"
"7bbae5d13bcde11541a6e2551d4476d9","柑蛆","柑蛆：一种果园寄生虫。被害果称“蛆果”、“蛆柑”，是国际国内植物检疫性有害生物。柑蛆自20世纪60-70年代开始发生以来，疫情呈逐年加重趋势。由于其发生面积大，危害损失重，疫区果实不准外销，给果农造成了巨大的经济损失，已成为柑桔生产上的第一大虫害。"
"7be37c3b456f802b25bed098cc9c8be6","佳粉17号","②特征特性。植株为无限生长型。叶片稀疏不易徒长，有利于通风透光，100%的植株上被有茸毛。主茎6～8节着生第一花序，熟性中早。果实稍扁圆和圆形，幼果具绿色果肩，成熟果粉红色，单果重180～200克。品质优良，适于保护地及露地栽培。高抗叶霉病和病毒病。对蚜虫及白粉虱具有一定驱避性。"
"7bed4cbc686ec8a627b9d921d26b330e","嘉星5号","嘉星5号属于锦葵科，分布在黄河流域。黄河流域棉区麦棉春套种植生育期121天，出苗一般，苗期长势弱，中期长势较强，后期长势一般，整齐度较好。适宜在山东西北部，河南中部，江苏、安徽两省淮河以北麦棉春套种植，应严格按照农业转基因生物安全证书允许的范围推广。"
"7bf9735e434525fd902c504fd8dc54f8","东亚岩蕨","植株高10-25厘米。根状茎短而直立或斜升，与叶柄基部均密被鳞片；鳞片披针形至卵状披针形，长约3毫米，先端长渐尖，棕色，膜质，边缘近全缘或具疏睫毛。孢子囊群圆形，位于小脉的顶端，靠近叶缘，沿叶缘排列成行；囊群盖杯形，边缘具睫毛或呈毛发状。"
"7bf9a98185c37f075aae4999af8fbf16","多棱球","多棱球为仙人掌科多棱球属，棱多且薄，刺长且宽，形态奇特。宜盆栽观赏。"
"7c129fd68c5f1ba6b88536f4aed3eda1","丝毛猕猴桃","丝毛猕猴桃(Actinidia fulvicoma Hance var. lanata f. arachnoidea (Hemsl.) C.F.Liang)形态为落叶藤本，花冠白色，花药黄色，浆果。分布于广西龙州市大青山地区。"
"7c1e3e93ac3b0901725dac51da40e0c6","两列毛小米草","两列毛小米草，所属玄参科，茎纤细而单生，直立，不分枝或少分枝，高达30厘米，密生两列白色柔毛。特产于我国台湾中部高山。"
"7c20b96d537185044474e6cab245748d","《动植物未解之谜全纪","《动植物未解之谜全纪录》是盛文林编著的科普类作品，由台海出版社在2011年1月1日出版。本着以热爱动植物为宗旨，以破译动植物未解之谜为视角，给读者展示了动植物精彩的未知世界。"
"7c223595b508f9e7e8760c212ca676b6","土地质量","土地质量是土地各种属性综合影响效应的总和。是土地的综合属性，也是土地对某种用途适宜不适宜,或适宜程度高低的表示。土地质量的差别，实质上是土地生产力高低的差异。土地质量可以用可度量测定的土地属性，即土地特性指标综合表述，也可以用土地生产力的指标表示，如产量、产值、净产值、纯收入、利润、级差收益等。在不同的土地利用状态下，土地质量的涵义也有差异。在农、林、牧业等利用中，土地质量指的是土地生物生产能力的差异，即土地劳动生产率的高低；在工业、交通、城镇等非农业建设利用中，则是指以区位条件优劣为主造成的劳动生产率或土地使用效益的差异。"
"7c320ddf0072be6d1b7fba67d5f891b1","黑布仑","黑布仑，又叫黑布李或黑李子。 其外形酷似李子，果径约4厘米，但颜色稍深，呈黑紫色，口感厚实甘甜，皮微酸。 黑布仑不是我国的原生水果，是自美国，新西兰等地引进的，在我国长江以南都可种植，台湾地区也有部分种植。"
"7c35d2f345191e1248947b52e5977311","柠檬瓜条","柠檬瓜条原料处理：此制品所用的番木瓜可以是盐胚半成品，也可以是新鲜番木瓜。如用新鲜木瓜需要去皮、去籽、切片。如果是半成品盐胚就需浸水脱盐，用大量清水浸泡脱去盐份，应留在原料中的盐份多少为合适，一般1—2%为好，脱盐后的木瓜片稍为烘干表面水分备用。本品柠檬瓜条需用柠檬果汁，柠檬通过榨取汁液备用。"
"7c6c715de4e91c66323deef19f3951a9","丝毛木蓝","丝毛木蓝属于植物界被子植物门，双子叶植物纲，原始花被亚纲，刺荚木蓝亚属。"
"7c805288b350338f4d2c26d022e606b3","对叶杓兰","对叶杓兰，兰科花卉植物。分布于甘肃、台湾、湖北、四川和日本。"
"7c8434e95bc97513ffbe9947c38cd9f0","华福花","华福花（学名：Sinadoxa corydalifolia）为五福花科华福花属的植物，是中国的特有植物。分布在中国大陆的青海等地，生长于海拔3,900米至4,800米的地区，多生长于砾石带及峡谷潮湿地，目前尚未由人工引种栽培。"
"7c8e6b0c0ede156161cf3fd66ceaaa29","粤引澳卡菠萝","粤引澳卡菠萝属于卡因类菠萝品种，从澳大利亚引进，由广东省培育而成。"
"7c9254d17366bf8d38940915787f88d8","秦椒","秦椒，是辣椒中的佳品，素有“椒中之王”的美称，具有颜色鲜红，辣味浓郁，体形纤长，肉厚油大，表面皱纹均匀等特点，含维生素丙和多种营养成分。分为青、干两种，尤以干椒最为有名，研面油泼后，为佐食佳品。制成辣子酱，香醇适口。主要产于关中八百里秦川。秦椒含维生素丙和多种营养成分，经常食用，可以健胃，增加食欲。秦椒素有“椒中之王”的美称，是陕西一项大宗出口商品，畅销国际市场。"
"7c9cba6b8eda9883e8a595ebb94c74a5","宝珠梨","宝珠梨产于云南省昆明郊区呈贡县，是当地的特产水果。具有皮薄，果肉雪白，脆嫩，汁多，味浓甜，微香等特点。"
"7ca7d9194647a9680ec9791b846677f8","下田菊","下田菊（拉丁学名：Adenostemma lavenia (L.) O. Kuntze）菊科下田菊属一年生草本植物。茎直立，单生，头状花序，花序分枝粗壮；瘦果倒披针形，花果期：8-10月。下田菊全草药用，有清热利湿，解毒消肿之功效。味苦，凉。用于风湿关节痛，咳嗽痰喘，咽喉肿痛，乳蛾，黄疸，痈疖疮疡。"
"7cabe399379772eb59a80efe00dcee01","美丽月见草","美丽月见草，别名：待霄草、粉晚樱草、粉花月见草，拉丁文名：Oenothera speciosa，英文名：evening primrose（晚樱草），是月见草的一种，柳叶菜科、月见草属多年生草本，具粗大主根（粗达1.5厘米）；茎常丛生，因它在傍晚见月开花，且天亮即调谢，故名月见草，但美丽月见草白天也会开放，花朵如杯盏状，引来粉蝶翩翩飞舞，甚为美丽。丛生状种植，营造出别样的自然园林风情。"
"7cde73daade9e025c7b039a4d3b095d0","开封菊花花会","“中国开封菊花文化节”前身为“中国开封菊花花会”，始于1983年，2013年升格为国家级节会，更名为“中国开封菊花文化节”， 由国家住建部和河南省人民政府主办。中国开封菊花文化节是一个融赏花观灯，旅游观光，经贸合作与交流为一体的大型综合性经济文化活动。"
"7cf7a5fa677f8ccb8694813e0a67b2b0","蜜宝西瓜","蜜宝又名台黑，幼果期果面深绿色,隐约呈现绿色条纹,成熟后果面有白色的果粉。单瓜重6一7斤,大者可达12斤左右。皮厚约1.2一1.5,坚初,耐贮运。"
"7d141b182d4c1bbb969143555847fc0a","紫莳药","紫莳药，是普通山药的一个地方品种，是薯蓣科紫莳药属草本蔓生性植物。"
"7d222e14dec35c61eea7fcdd9025ebbe","五九香梨","五九香梨是中国农业科学院果树研究所育成的梨新品种。又称贵妃梨、香蕉梨。亲本为鸭梨×巴梨，1952年杂交，1959年通过鉴定并命名。该品种在北京郊区、甘肃兰州、河南洛阳、云南、河北和辽宁等地已有栽培，表现良好。很多省有引种试栽，有的已列为推广品种。"
"7d4d5892decd41910f4298cf3cd9ba90","新椒4号","新椒4号，二名法：Capsicum annuum L. var. grossum (Willd.) Sendtn.。植物界，被子植物门，木兰纲，菊亚纲，茄目，茄科。"
"7d517b8324b2afa63c1c776b3131a1b2","惠丰3号","惠丰3号，甘蓝新品种，山西省农科院蔬菜研究所选育，球叶脆嫩，风味品质好，抗病毒病、黑腐病、霜霉病等，适宜在华北地区作中早熟秋甘蓝栽培。"
"7d5af7e37d91d7833af53b7b50319ce0","一枝旗","一枝旗，中药名。为水龙骨科植物攀援星蕨（Miq.）Ching的全草。分布于浙江、江西、福建、台湾、湖北、湖南、广东、广西、四川、贵州等地。具有清热利湿之功效。常用于尿路感染，小便不利，黄疸。"
"7d7106476f2395fffe450710ff6cbee3","南校205","南校205是广西农业职业技术学院玉米育种中心以自选自交系TS68为母本，辐288为父本育成的高产、优质、多抗玉米新品种，在广西玉米新品种区域试验中表现高产、优质、抗病和抗倒等特点，可在广西壮族自治区全区种植。"
"7d837232dca09fc923d96428d3d49837","南江2号","南江2号属无性系。灌木型，中叶类，早生种。二倍体。 由四川省农业科学院茶叶研究所(今重庆市茶叶研究所)于1964～1993年从南江大叶群体中采用单株育种法育成。重庆永川等地有栽培。1995年四川省农作物品种审定委员会审定为省级品种。"
"7d8446689efbcae413cd1e4d95636194","打麦","打麦：一是词语名称，意为用工具使麦子去皮或脱粒。二是儿童的一种游戏。三是宋代张舜民的一首杂言诗。"
"7d847a5a257d61177c7130c8ea0a3aba","上党连翘","连翘是中国临床常用传统中药之一，又名黄花条、连壳、青翘、落翘、黄奇丹等。"
"7d9a90e70467b91b787051b13148e772","三脉菝葜","三脉菝葜是百合目百合科植物，生于林下或灌丛中；海拔400-1700米。"
"7d9fea9a3b4118d0490c996777be7ea1","报春花灰霉病","报春花灰霉病主要侵染叶片、嫩茎、花器等部位。病害多在叶尖、叶缘处发生。在潮湿的条件下，病部出现灰色霉层，是该病的一大特征。"
"7da9cdc568291730202a86234f509520","康乃馨黑斑病","康乃馨黑斑病是叶片上初呈现油浸状小斑点，病斑扩大后呈长椭圆形茶褐色病斑，老的病斑上形成黑色粉状霉层，严重时造成叶片枯萎的植物疾病。"
"7dc910ac962a1552997a8bb4bcde6e8d","木贼","木贼（学名：Equisetum hyemale L.），别称：千峰草、锉草、笔头草、笔筒草、接骨草、马人参等。多年生常绿草本，高30-100厘米。根状茎粗短，黑褐色，横生地下，节上生黑褐色的根。地睛茎直立，单一或仅于基部分枝，直径6-8毫米，中空，有节，表面灰绿色或黄绿色，有纵棱沟壑0-30条，粗糙。喜生于山坡林下阴湿处，易生河岸湿地、溪边，或杂草地。主产于中国东北、华北、内蒙古和长江流域各省。药用为木贼科植物木贼的全草，木贼味甘、苦，性平。归肺、肝经，具有疏散风热、明目退翳、止血的功效。木贼夏季采收，除去杂质，晒干或阴干贮藏，药用炮制： 除去枯茎及残根，喷淋清水，稍润，切段，干燥。切断段。"
"7dd64eb10e611108836e5b99f267cdb2","白术","白术（zhú），拉丁学名 Atractylodes macrocephala 。别名桴蓟，于术，冬白术，淅术，杨桴，吴术，片术、苍术等，属于菊科、苍术属多年生草本植物。喜凉爽气候，以根茎入药，具有多项药用功能。主要分布于四川、云南、贵州等山区湿地。白术具有健脾益气，燥湿利水，止汗，安胎的功效，用于脾虚食少，腹胀泄泻，痰饮眩悸，水肿，自汗，胎动不安。《医学启源》记载：“除湿益燥，和中益气，温中，去脾胃中湿，除胃热，强脾胃，进饮食，安胎。”"
"7dd6583ab3f54c9fca9c8ddf3c10569b","海南西州蜜瓜","西州蜜瓜不但好吃，而且营养丰富，药用价值高。 1、蜜瓜含糖较多，糖尿病人不宜吃。 3、蜜瓜性凉不宜吃的过多，以免引起腹泻。"
"7de4b4319deb8f7f62b12d191b70947d","中油6766","中油6766是选育单位：中国农业科学院油料作物研究所，用品种A4×Y15选育而成的油菜品种。 2008年12月2日第二届国家农作物品种审定委员会第二次会议审定通过，审定编号为国审油2008002。"
"7df40f39c5cfe1f946680924c558e210","庐山堇菜","庐山堇菜,堇菜科,堇菜属, 多年生草本。主根长；根状茎粗壮，密生结节。"
"7e0097422d447af23277eebcf3838a5d","刺葵","刺葵（Phoenix hanceana Naud.）棕榈科植物，茎丛生或单生，高2-5米，叶长达2米，羽片线形，雌花序分枝短而粗壮，雄花近白色，花瓣圆形，果实长圆形，长1.5-2厘米，成熟时紫黑色，花期4-5月，果期6-10月。刺葵产于台湾、广东、海南、广西和云南等省区，生于海拔800-1500米的阔叶林或针阔混交林中。刺葵树形美丽，可作庭园绿化植物，果可食，嫩芽可作蔬菜，叶可作扫帚。"
"7e097eb63785cb17c567f575c64e23a5","三叶五加","三叶五加，又名：刚毛白勒花、三加皮、刺五加。药名：二加皮。五加科藤状灌木，高2-7米，小枝具向下倒钩的皮刺。复叶具小叶3片，小叶纸质，卵形、长卵形，长4-8厘米，宽2.5-6厘米，边缘具粗或细锯齿。生于溪边、山脚、路旁及丘陵地的灌木丛中。分布于我国华南、华中、西南等地。"
"7e13ab0b93fca40ddb0bb40abdcb4ca9","布拉娜娜","布拉娜娜，是一种泰国水果，价格昂贵但十分爽口。原产于泰国，于2011年4月被德国人埃珀·绛因桐以及传架·利白芝发现，极其稀少，2011年7月在中国广州荔湾也有发现。"
"7e1447ffcf390a345e4bf096246b0bf8","三角叶堇菜","多年生草本，具地上茎，高13-35厘米。产浙江、江西、福建、湖南、广东、广西。生于山谷溪旁、林缘或路旁。"
"7e1a5003607704224b591457df9135b1","华桑","华桑（学名：Morus cathayana Hemsl.）是桑科，桑属落叶乔木或灌木，无刺；冬芽具芽鳞，呈覆瓦状排列。叶互生，边缘具锯齿，全缘至深裂，基生叶脉三至五出，侧脉羽状；托叶侧生，早落。花雌雄异株或同株，或同株异序，雌雄花序均为穗状；雄花，花被覆瓦状排列，雄蕊与花被片对生，在花芽时内折，退化雌蕊陀螺形；雌花，花被片覆瓦状排列，结果时增厚为肉质，种子近球形，胚乳丰富，胚内弯，子叶椭圆形，胚根向上内弯。分布于中国产河北、山东、河南、江苏、陕西、湖北、安徽、浙江、湖南、四川等地。常生于 海拔900-1300米的向阳山坡或沟谷，性耐干旱。朝鲜、日本也有。（概述图参考来源：中国自然标本馆"
"7e2f133d3c808b8f88d3c7a351061296","宁玉525","宁玉525，由南京春曦种子研究中心培育的一种东北早熟春玉米品种，产量比照吉单261高，在辽宁东部山区、吉林中熟区（榆树除外）、黑龙江第一积温带上限、内蒙古赤峰和通辽种植。"
"7e39f7bc065fa42239bd00604df679de","京椒1号","京椒1号是来源于北京市种子公司，抗病毒病较强的蔬菜品种"
