"3e41d9d4c0d4e9a96262271e65e7646c","花牛苹果","花牛苹果，甘肃省天水市特产。系指产于该市大部分地区的元帅系优良品种苹果，为中国国家地理标志产品。产品肉质细，致密，松脆，汁液多，风味独特，香气浓郁，口感好，品质上。被许多中外专家和营销商认可为与美国蛇果、日本富士齐名的世界三大著名苹果品牌。是中国在国际市场上第一个获得正式商标的苹果品牌。2016年10月20日，国家工商总局认定“花牛苹果”为“中国驰名商标”"
"3e5381ff8773204b7e587dd3be5e9555","子孙球","子孙球（学名：Rebutia minuscula K.Schum.）是仙人掌科子孙球属植物。植株小，球形至圆筒状，基部易生出仔球而丛生，大大小小，叠垒成群。球体鲜绿色或墨绿色，棱16-20，疣粒顶端为刺座，生有灰白色的弯刺，刺25-30，白色或淡黄色，长0.2-0.3厘米。花着生在球下部刺座上，花小。花期3-5月。盛开时，花朵数十朵，呈现倒钟形。花后坐果，小浆果圆形，浆果幼时绿色。种子黑色。原产于南美洲阿根延北部网库曼省安第斯山的东坡，约海拔2000米左右。原产地灌术杂草丛生，该种常生长在草丛中，土壤中的水分和肥力都较好，夏季有杂草遮阴。 性喜温暖和阳光照射的生态环境，也能耐半阴。对土壤要求不严，一般中性的砂质上壤就能旺盛生长。该种球体小巧秀气，开花又多，在室内散射光条件下生长良好，为理想的家庭小型盆栽品种。点缀窗台、书桌、几案非常雅致，也可种在小动物形容器内或布置“景箱同艺”。此外，植于浅盆作仙人掌类盆景也别有风味。（概述图参考来源： ）"
"3e549857e65bce9f51247709a0522edd","先锋橙优系红6—6","具有以下突出经济性状：(1)果较大、皮薄、质优：平均单果重162g，果形多为椭圆形，果皮深橙至橙红色，皮薄。 (3)果实于11月下旬至12月上旬成熟，比先锋橙老系品种提早成熟7天左右。 (5)耐贮性好，其耐贮性比锦橙还强，是21世纪中熟甜橙换代新品系之一 。"
"3e5b1074661f1a50356b8bc32b62fc1a","东亚唐松草","东亚唐松草（学名：Thalictrum minus var.hypoleucum）为毛茛科唐松草属下的一个变种。"
"3e707ce61840da9f38e982be78c330f0","彬林1号芒果","彬林1号芒果果形艳丽，呈水蜜桃色，甜度在19度左右，口感与风味特佳，果重约500克。2002年从台湾引进，有一定的面积和产量。"
"3e909cbdfa244bdb07e7be7c4ae3e9ad","马醉木","马醉木（学名：Pieris japonica (Thunb.) D. Don ex G. Don）是杜鹃花科，马醉木属常绿灌木或小乔木，高可达4米；树皮棕褐色，冬芽倒卵形，叶片革质，密集枝顶，无毛，表面深绿色，背面淡绿色，叶柄腹面有深沟，总状花序或圆锥花序顶生或腋生，直立或俯垂，花序轴有柔毛；萼片三角状卵形，花冠白色，坛状，无毛，花丝纤细，有长柔毛，子房近球形，无毛；花柱细长，蒴果近于扁球形，4-5月开花，7-9月结果。分布于中国安徽、浙江、福建、台湾等省。日本也有分布。生于海拔800-1200米的灌丛中。栽植宜避免高温之强烈日光直射，土质以富含腐植质之壤土或砂质壤土为佳。马醉木叶有毒，可作杀虫剂。 虽有毒，但依然是受人喜爱的植物，无论是用于插花、盆栽，或作为绿篱、庭植等露地栽培，是优良的木本花卉。马醉木花色淡白绿色，可作切花、盆景、绿篱和庭园露地栽培。已被开发为年宵花卉。（概述图参考来源：中国自然标本馆 ）"
"3e991e77d188b9531f343e0ad2e84a57","旱优3号","旱优3号由上海市农业生物基因中心选育，2006年3月通过上海市品种审定委员会审定。"
"3e9a108f1b8918c59c469a3ad6b5c6a4","地涌金莲","地涌金莲，拉丁学名（Musella lasiocarpa (Franch.) C. Y. Wu ex H. W. Li）原产中国云南，为中国特产花卉。假茎的叶腋处为真正的小花朵，清香、娇嫩，黄绿相间，更添一份精巧的美丽，花期长达半年之久。地涌金莲被佛教寺院定为“五树六花”之一，也是傣族文学作品中善良的化身和惩恶的象征。云南民间还利用其茎汁解酒、解毒，制作止血药物，现北京植物园热带温室已引种栽培这一美丽的植物。"
"3ec1324978fe58423e4b0c3839b4ce66","代代花","代代花，别名：酸橙、回青橙、玳玳。拉丁文名：Citrus aurantium L. 属芸香科、柑橘属植物。小乔木，枝叶密茂，刺多，徒长枝的刺长达8厘米。它绿叶婆娑，金果悬垂，是家养花卉中难得的佳品。代代花的果实初呈深绿色，成熟后显橙黄色，不脱落至翌年春夏又变成青绿色，故有“回青橙”之称。如养护得法，果实可宿存到第三年，故又名“代代”。5 ～ 6 月花未开放时分批采摘，及时干燥。以完整、色黄白、香气浓者为佳。代代花主产地是中国浙江，现中国东南部诸省均有栽培。华北及长江流域中下游各地多盆栽。"
"3eeae55550e54d668d09f1c273c29a36","分叉脉序","分叉脉序各条叶脉均呈多级的二叉状分枝，是裸子植物银杏具有的一种比较原始的脉序，并普遍存在于蕨类植物中。另外还有两种不同的脉序。"
"3f1897fc1c5536fe04a9dad7aba01f79","五彩红星","五彩红星为凤梨科彩叶凤梨属的一种，多年生草本植物，是花架、台桌、橱柜和茶几上摆放的极好材料。"
"3f279fc712953b2d10e6b86793963ef9","红色芹菜","美国佛罗里达州一家农产品公司即将推出红色芹菜，它是红色的，看起来亮丽夺目，与众不同，这一颠覆传统的蔬菜或许会为美国人的餐桌增色不少。"
"3f573fb6cd6a486aea881477b60d0d12","蛇皮果","蛇皮果（学名：Salacca zalacca (Gaertn.) Voss）是棕榈科，蛇皮果属植物，植株相对较小，雌雄异株，叶羽状全裂，羽片披针形或线状披针形，呈“s”形或镰刀状；花序生于叶闻，总花序梗及分枝被包于宿存的佛焰苞内，花萼和花冠管状，花丝短，果实球形、陀螺形或卵球形，顶端具残留柱头，种子长圆形、球形或钝三棱形，味酸或甜，胚乳均匀、坚硬，胚基生。蛇皮果是地域性水果，对产地的光、温、水等需求具有专一性，如对温度要求较高，中国华南各地零星引进种植。蛇皮果其风味鲜美、营养丰富，在国际市场上颇受欢迎，是东南亚著名的水果之一。（概述图参考来源：中国自然标本馆 ）"
"3f5a1a8b0cd1066ae593e9307ce7368f","夏番茄防雨遮阳高效栽","夏番茄生长期间正值高温多雨季节，花芽分化少，果实易脱落，病虫危害重，产量低，品质差。使用防雨膜、遮阳网双层覆盖栽培夏番茄，可以明显提高产量和品质，一般亩产可达4000千克。"
"3f6445ba8861d4df2bb318c708ce7450","《地锦草》","地锦草别名：草血竭、血见愁草、小虫儿卧单等。为大戟科植物地锦，夏、秋二季采收，除去杂质，晒干。主治：清热解毒；利湿退黄；活血止血。主痢疾；泄泻；黄疸；咳血；吐血；尿血；便血；崩漏；乳汁不下；跌打肿痛及热毒疮疡等。"
"3f6a85e3c2010a9c224008b90fa16108","天价君子兰","随着生活水平的提高，盆景已成了一种高消费品，各种名贵盆景的价格已经扶摇直上，各地频频爆出天价盆景，如沈阳和长春都爆出过价格过百万甚至过千万的天价君子兰。"
"3f73e72c76c1da7d64c80551aa6039ee","割晒机","是一种特殊型式和用途的收割机。割倒小麦禾秆，将其摊铺在留茬上，成为穗尾搭接的禾条，以便于晾晒的谷物收获机械。晾晒后的禾条由带捡拾器的谷物联合收割机捡拾收获，也可用于收割牧草。割晒机出现于20世纪20年代末，以后在美国、加拿大和苏联等国广泛使用。中国自1947年起，先在东北等地的国营农场逐步推广使用，1952年开始研制生产。"
"3f850283bd59b1b7511de0c24043d99f","两体雄蕊","两体雄蕊 (diadelphous stamens)被子植物花中雄蕊存在的一种形式。一花中10枚雄蕊的花丝连合成二束，如蚕豆、豌豆的雄蕊，其中9枚花丝连合成一束，另一枚雄蕊单独分离，或者每束5枚。这种雄蕊为蝶形花科（或豆科）植物特有。为植物之雄性生殖器官，包括花丝（Filaments）及花药(anther)两部份，花粉（Pollen）则存在花药中。 
雄蕊由花丝联合成通常数目不等的两束。每朵花有雄蕊10枚，其中9枚的花丝联合，1枚分离，成二组，如大豆；或每5枚的花丝联合而成二组，如紫穗槐。"
"3f8b5490e467f50e6afa3e2495d1cdb4","东北顶球洋葱","东北顶球洋葱又叫毛子葱、头球洋葱、埃及洋葱。在黑龙江省哈尔滨市郊、吉林省双阳县均有栽培。"
"3f9eea3599fe477035d7bc2fa9d641da","晚红葡萄","晚红葡萄又名“红地球”、“大红球”、“全球红”、“红国红提”等，由沈阳农业大学葡萄组于1987年从美国首次引入中国。原产美国，加州大学育成，欧亚种，国庆节成熟，果肉硬脆，可切片，因此特耐贮藏运输，可贮藏至第二年5月份上市。外观十分漂亮，味甜香味浓，口感佳，品质优，商品价值高。"
"3fa0509fafc3f2b6d529a9b3bfd14ad5","甜豆","甜豆，是豆科属，一年生攀缘草本植物，食用嫩荚。原产欧洲南部及地中海沿岸地区，其营养价值很高，属于高档细菜，在欧美国家种植普遍，中国在广东、广西、四川和云南等南方省市种植广泛。随着近几年的对外开放，搞活经济，北京地区开始逐年扩大种植面积。甜豆含有多种人体必需氨基酸、营养丰富。可清炒、做汤、涮食皆可。"
"3fa7e988dcc2f98cf3cb5a84549fe26a","夜来香","夜来香（学名：Telosma cordata (Burm. f.) Merr.）： 柔弱藤状灌木；小枝被柔毛，黄绿色，老枝灰褐色，渐无毛，略具有皮孔。叶膜质，卵状长圆形至宽卵形，叶脉上被微毛。伞形状聚伞花序腋生，着花多达30朵；花芳香，夜间更盛；花冠黄绿色，高脚碟状，花冠筒圆筒形，喉部被长柔毛，裂片长圆形，具缘毛，干时不折皱，向右覆盖；副花冠5片，膜质，着生于合蕊冠上，花柱短柱状，柱头头状，基部五棱。蓇葖披针形，外果皮厚，无毛；种子宽卵形，顶端具白色绢质种毛。花期5-8月，极少结果。花芳香，尤以夜间更盛，对人的健康极为不利，因而在晚上不应在夜来香花丛前久留。常栽培供观赏。华南地区有取其花与肉类煎炒作馔。花可蒸香油。花、叶可药用，有清肝、明目、去翳之效，华南地区民间有用作治结膜炎、疳积上眼症等。生长于山坡灌木丛中，原产于中国华南地区，现中国南方各省区均有栽培。亚洲热带和亚热带及欧洲、美洲均有栽培。（概述图片参考资料来源： ）"
"3faed123664f2d006924d10038c6c9a7","中科10号","中科10号--由北京联创种业有限公司选育，于2006年10月26日申请。"
"3fb139567305fbd63ce9398fc5fbcdf3","苦芒菜","“苦芒菜”即是苣荬菜，Sonchus arvensis L.，菊科苦苣菜属植物。苣荬菜是一种野菜，学名叫“苦苣”。李时珍《本草纲目》中记载：“苦苣。春天生长幼苗，有红茎、白茎两种，折断后有白汁流出……味苦，性寒，无毒……主治五脏邪气，厌食胃痛。”具有清清热解毒之功效。"
"3fbb2a07f670d8fcef40b5ff15f2219a","沙巴珍珠","沙巴珍珠葡萄，1951年引入中国，各地有少量栽培。沙巴珍珠成熟极早，品质优，抗病性较强，产量中等，是优良的鲜食品种。果实在陕西关中于7月中旬成熟，较一致。由萌芽至果实充分成熟需要100～115天，为极早熟品种。"
"3fd6966a5f4db42c6aee93b9dee5563a","万源小檗","为小檗科小檗属的植物。分布在中国大陆的云南、四川等地，生长于海拔1,500米至2,700米的地区，常生于山坡以及路边，目前尚未由人工引种栽培。"
"3fd6c2f89658399fcde313b477b18e37","琥头","琥头，仙人掌科观赏植物， 原产自美国加利福尼亚南部干旱地区。单生，少有从基部长出仔球。球体亮绿。具棱13-23，棱钝而阔。刺白、黄或红色。辐射刺9-13，具不同颜色的环纹，尖锐弯曲，中刺4，有棱或扁平，伸展并强烈弯曲。春、夏季开花，花黄或橙色，钟形。果圆至长圆形，种子大，黑色。"
"3fe03426fd4aa5432808827bbf076efd","水八鲜","“水八鲜”是指南京地产的8种水生植物。南京地区河湖纵横，池塘密布，是水生动植物生长的良好场所。其中，莲藕、红菱、茭白、芡实（鸡头果）、荸荠、水芹、莼菜、慈姑8种水生植物，人称“水八鲜”。食用“水八鲜”为南京人的传统习俗。"
"3fe4cef54afeee524c89da7de624d2ca","乡果网","它是集洛川县品牌宣传、洛川苹果文化展示，消费者网上购买洛川苹果的电子商务网站。 乡果网作为洛川苹果“两店一网一中心”营销策略的重要门户，必然要为洛川苹果进军大城市高端消费市场树立旗帜。 乡果网快速有效的实现，原汁原味的洛川苹果送到北京消费者手中，满足高端消费者对经典绿色苹果的需求。"
"3ff5041e93ae4e320378580106a8f2f8","中双11号","中双11号是选育单位：中国农业科学院油料作物研究所，用品种(中双9号/2F10)//26102选育而成的油菜品种。 2008年12月2日第二届国家农作物品种审定委员会第二次会议审定通过，审定编号为国审油2008030。"
"3ff6ce2268bdac6e7fd22c2f9754d4dd","狼毒属","狼毒属属于被子植物门蔷薇亚纲瑞香科分布于亚洲温带地区，多年生草本或灌木。中国产西南部至西北部和台湾。"
"3ffb3c041f7b99c787288d5cc0195886","北豆18","北豆18是黑龙江农垦总局红兴隆农业科学研究所选育出的大豆新品种，原代号钢9775-2，2008年1月通过国家品种审定委员会审定推广(国审豆2008015)，属高油品种，黑龙江省第二积温带和第三积温带上限、吉林省东部地区春播种植。该品种平均生育期120天，长叶、紫花、亚有限结荚习性。株高85.8厘米，单株有效荚数34.4个，百粒重19.0克。籽粒圆形，种皮黄色，黄脐。接种鉴定，中抗大豆灰斑病，中抗SMVⅠ号株系，中感SMVⅢ号株系。粗蛋白质含量40.78%，粗脂肪含量21.99%。"
"400633f8c84a9e8c7c3de27cf4291a04","南美水仙","南美水仙（Eucharis granndiflora） 为石蒜科油加律属常绿鳞茎植物， 又名亚马逊百合、 大花油加律 。多年生草本花卉。叶片宽大，深绿色有光泽。花莛长50～60厘米，顶生伞形花序，着生5-7朵花。花为纯白色，花径7.5厘米，有芳香。花冠筒圆柱形，中央生有一个副花冠，花瓣开展呈星状。花期冬春季。姿态优雅，亭亭玉立。花朵硕大，洁白无瑕，清香四溢，是室内盆栽花卉的佳品。"
"400bc502b1abddbe772abd6fd293cd16","小黄花菜","小黄花菜（学名：Hemerocallis minor Mill.）是百合科，萱草属多年生草本植物，根一般较细，绳索状，不膨大。花葶稍短于叶或近等长，花梗很短，苞片近披针形，蒴果椭圆形或矩圆形，5-9月开花结果。分布于中国黑龙江、吉林、辽宁、内蒙古、河北、山西、山东、陕西和甘肃。朝鲜和俄罗斯也有分布。生长在海拔2300米以下的草地、山坡或林下。（概述图参考来源：中国自然标本馆 ）"
"4011cd6160517946334e6d9a1e0a710e","华玉四号","华玉四号的选育单位是华中农业大学玉米研究室 ，品种来源为母本是HZ85；父本是S7913-1-3。 1998年湖北省农作物品种审定委员会审定。"
"4014c404ea37263ee226e63a2781e1e7","威宁大黄梨","威宁大黄梨是中国的名梨之一，它皮薄，色呈金黄，肉质细嫩，含糖量高，个大核小，耐运耐藏而行销省内外。当地人还喜欢用威宁大黄梨制梨膏、晒梨丝。并将它挖空，灌进蜂蜜，蒸后吃了可以止咳。威宁大黄梨因原产于威宁而得名，迄今已有280多年的栽培历史，是中国砂梨系统中鲜食与加工兼用的著名品种。其主要优点是植株生长健壮，经济寿命长，产量高，果大皮薄，质细汁多，可溶性固形物含量高(13%～15%)，甜酸适口，风味浓，果实耐贮耐运等。该品种曾列中国八大名梨之一，其产品在中国南部和西部各省（区）都有很好的销售市场。"
"402613b30be2cd4ac1f33639b6dbe153","代代酸橙","代代酸橙cv. Daidai，简称代代，又名回青橙、春不老、玳玳圆。曾被作为一个独立的种 /C. daidai/ Sieb.或视为变种 /C. aurantium/ var. /daidai/ Tanaka。（概述图参考来源： ）"
"4029c98b1ddf90875bc2558288fe8c7b","豌豆立枯病","200倍液，或68．9%安，克锰锌可湿性粉剂1 000倍液，或60%灭克锰锌可湿性粉剂1 500倍液，或58%甲霜·锰锌可湿性粉剂500倍液等药剂喷雾。"
"402bb35419ce5d05b35b2c3e0132a7bb","缤红3号","亮红果，近圆果形，硬脆肉，果重约20克；一代杂交品种，无限生长类型，长果串；耐储运，抗病性强，品质好，产期长。"
"4031934e19ed6dce047a9a357eb02c00","光能利用率","光能利用率是衡量一定面积农作物利用光能程度和生产水平的指标。单位土地面积上一定时间内植物光合作用积累的有机物所含能量与同期照射到该地面上的太阳辐射量的比率。其计算公式为：光能利用率等于 (植物干物质重量或干重增长量斤/亩×500克/斤×4.25千卡/克) 除以 (太阳辐射能总量卡/平方厘米×666.7平方米/亩×104平方厘米/平方米) 乘以100%。其中：4.25千卡/克表示一克植物干物质 (碳水化合物) 完全燃烧所释放的热量；666.7平方米×104平方厘米/平方米表示一亩土地的平方厘米数。"
"4045317d618ffeeb6b8748f944a02937","三蕊兰","三蕊兰，学名：Neuwiedia singapureana (Baker) Rolfe，产于香港、海南（保亭、定安）和云南东南部（河口）。生于海拔约500米的林下。越南、泰国、马来西亚、新加坡和印度尼西亚也有分布。模式标本采自新加坡。"
"4045558248b58a5d7e61a6e02fe65af5","三元梅","三元梅（春兰名品），梅瓣，外三瓣短圆，花葶高，捧舌端正，纹筋暗红色"
"405a03e296725adaddee34483bb983e5","早丰9号","早丰9号，由江苏省常州市武进区稻麦育种场以3012（武复粳）/中丹一号F2选早//农林205（丰玉）杂交，于1987年育成的中熟中粳品种，以其亲缘和组合形式而命名。1997年通过江苏省品种审定。适宜在江苏省淮北、苏中稻区中上等肥力条件下种植。"
"405cea82ff0a31d9f9756d119d840fd2","大马士革月季","大马士革月季，属蔷薇科，蔷薇属。"
"407ccf30ee694fe517a6fcb321d7a0b7","大花葱","大花葱（学名： Regel）是百合科，葱属多年生球根花卉，根鳞茎肉质，具葱味。叶片丛生，灰绿色，长披针形，伞形花序，头状，花、果实及种子密集的着生于花尊顶端，小花紫红色, 具长柄，种子圆形，黑色。 原产亚洲中部，世界各国园林中多有种植。荷兰为主要鳞茎出口国。中国科学院植物所北京植物园1979年从荷兰引种鳞茎。 该种是花境、岩石园或草坪旁装饰和美化的品种。大花葱花序硕大如头，故名。其花色紫红, 色彩艳丽, 是同属植物中观赏价值最高的一种。 （概述图参考来源：中国植物图像库 ）"
"408f2ceebbed80a53496f436f1d1759a","四照花","四照花（学名：Dendrobenthamia japonica (DC.) Fang var. chinensis (Osborn.) Fang）是山茱萸科四照花属植物，落叶小乔木，高5-9米。单叶对生，厚纸质，卵形或卵状椭圆形叶柄长5-10毫米，叶端渐尖，叶基圆形或广楔形，，脉腋具黄褐色毛或白色毛。头状花序近球形，生于小枝顶端，具20-30朵花；花萼筒状；花盘垫状。果球形，紫红色；总果柄纤细，长5.5-6.5厘米，果实直径1.5-2.5厘米。花期5-6月，果期8-10月。分布于内蒙古、山西、陕西、甘肃、江苏、安徽、浙江、江西、福建、台湾、河南、湖北、湖南、四川、贵州、云南等省区。生长于海拔600-2200米的森林中。果实成熟时紫红色，味甜可食，又可作为酿酒原料。（概述图参考资料来源： ）"
"40917dd659c009c806a0a4ada5de26f8","三色朱蕉","三色朱蕉，所属植物界，属龙舌兰科常绿灌木，单茎，茎干呈棒状，直立，细长，丛生。叶革质，宽披针形，聚生顶端。由于与龙血树相似。容易混淆，又称三色龙血树。叶鲜绿色镶有乳黄色、草绿色条斑，边缘具红色及粉红色斑块．分布于东南亚及澳大利亚、新西兰。"
"40a7560f5eeb55acb8b03a270c855271","东方毛蕨","东方毛蕨（Cyclosorus orientalis），毛蕨属植物。植株高60-80厘米。根状茎横走，先端及叶柄基部疏被褐棕色或淡棕色的披针形鳞片，并密生长柔毛。产于浙江（温州，江心屿）、台湾（台北、乌来）。"
"40b9e7fa9ea0ac261abdb745536751b3","岩黄耆族","岩黄耆族，草本、灌木或小灌木；奇数羽状复叶。果实数节或1节，不开裂，种子区为纲状脉，向边缘为放射脉，常具刚毛或刺。本族共7属，分布于欧亚、非洲和北美。中国有3属，主要分布于干旱和高寒地区。"
"40c429a2b06455fdde01387ee0e80afa","台湾藜芦","台湾藜芦，为多年生草本植物，高约30-40cm，叶子呈线型，无柄，先端渐尖，基部有叶鞘包住，叶子光滑无毛。"
"40c6d3e3086bcd8d97e1a3553f7ad1dc","中优4480","中优4480组合是广西钟山县种子公司利用中九A与恢复系4480组配育成的感温型中熟组合。2001年通过广西农作物品种审定委员会审定，品种审定编号：桂审稻2001009号。适宜广西桂中、桂北作早、晚造种植。中优4480组合在桂中北种植全生育期早造120～124天，晚造105～110天，株型集散适中，株高早造110厘米左右，晚造95～100厘米，茎秆淡青色，叶片挺直，分蘖力中等，亩有效穗18～20万穗，每穗总粒110～130粒，结实率82%，千粒重25克，谷粒细长，外观米质较优，田间种植表现抗稻瘟病能力一般、抗倒能力稍差。"
"40c91f1c07bc86c46b45b6b8a296d176","东方野豌豆","东方野豌豆，多年生攀缘性草本，高60-120厘米。茎细，具稜，稍有毛或无毛。偶数羽状复叶，具(4)5-7对小叶，叶轴末端具分歧的卷须；托叶小，长4-7(9)毫米，二深裂至基部附近，裂片线形、锐尖。"
"40cabba36c134a89f5c1008fba21f005","小叶黄耆","小叶黄耆（学名：Astragalus hulunensis P. Y. Fu & Y. A. Chen）是豆科黄芪属的植物，多年生草本。分布于中国大陆的内蒙古等地，生长于海拔700米的地区，多生长于干山坡石砾地。"
"40d8f88e3f4bee3addc46a322fcbb960","土地评价","土地评价所涉及的内容比较广泛，需要自然科学、社会经济科学和技术科学多学科的知识进行综合研究。它可按不同的地区范围进行（如全世界、一国、一地区、一生产单位），也可以根据不同的土地利用类型进行。土地评价的内容根据不同的目的而有所差别，有从某项生产出发对土地质量的评价，有关于土地生产潜力的评价，也有着重于对某项生产适合或限制程度的评价等。"
"40e7dd084abda60958ee514fffdfce9c","七叶龙胆","七叶龙胆（学名：Gentiana arethusae var. delicatula）是龙胆科龙胆属川东龙胆的变种，是中国的特有植物。分布于中国大陆的四川、云南、西藏、陕西等地，生长于海拔2,700米至4,800米的地区，一般生于高山草甸、山坡草地、灌丛草甸、路边和林边草地。"
"40e8c2735701fccb7b91836293d3df89","三瓣苔","三瓣苔属，裂叶苔科，苔藓植物。产于新疆。"
"40edc964967024a9de1944f9597ecc3b","东莞润楠","东莞润楠，灌木，高2米，嫩枝被微毛或秃净。花期3月，果未见。主要分布于广东（东莞）。"
"40f7749b693e8f242845de85b12eecc9","奥山红宝石","奥山红宝石，欧亚种。为意大利的红色芽变。该品种从日本引入，晚熟品种，长势旺，抗性强，丰产性能好，耐贮运，大果穗，果粒重约9克左右，果色鲜红艳丽，糖度19度左右，是极具有发展前途的晚熟优良品种。10月底成熟，果色深红，晶莹透亮，美如宝石，因之而得名。"
"41068e6cb6ff7cf2e6bd286ca9a83996","滇西山楂","灌木，产云南西北部高山地区。花期5月，果期8—9月。"
"41089fc09aee06322be52d3363a8bec3","二年生花卉","二年生花卉。在两个生长季内完成生命周期的花卉种类。当年只生长营养器官，越年后开花、结实、死亡。这类花卉，一般秋天播种，次年春季开花。"
