"bb2ae91f6dcdd66b48e0509de3ddb93d","国十六条","为稳定物价，中央政府开出涉及16个方面的""药方""，主要措施为加大农产品供应和降低流通成本。国务院总理温家宝数日前即透露将出台应对物价上涨的措施，国务院正式发布关于稳定消费价格总水平保障群众基本生活的通知。中央政府此次稳定物价和保障中低收入群体基本生活的措施涉及16个方面，稳定物价则主要从保障农产品供应、降低流通成本以及价格监督方面入手，并重申“菜篮子”市长负责制。"
"bb2b4800a704d4bdfb37b66982754d72","山东成武天和利蒜业有","山东成武县天和利蒜业有限公司是一家常年从事于多种农产品的加工贸易等业务的企业，公司地理位置优越，交通便利。拥有自己的生产车间、冷藏库 及购销人员 、管理人员、加工人员。"
"bb3fc910b7303b72887ec49385e85352","斗南","北斗星以南，简称斗南。"
"bb435cadaca8ce4f5280bbef32911f03","垂花火鸟蕉","金嘴蝎尾蕉（Heliconia rostrata Ruiz & Pavon）：芭蕉科，蝎尾蕉属多年生草本植物。株高可达6米。叶片长圆形，叶面绿色，叶背亮紫色；顶生花序，直立，薄被短柔毛；苞片绿色，开放时突露，花被片红色，顶端绿色，狭圆柱形，果三棱形，灰蓝色，有种子不多于3颗。5-10月开花。原产美洲热带地区阿根廷至秘鲁一带，华南地区有栽培。 喜温暖、湿润的环境。金嘴蝎尾蕉的花序长而下垂，花姿奇特，花色艳丽，花形似鸟喙状，东南亚一带极受人们的欢迎。（概述图片参考：中国自然标本馆 ）"
"bb54b6acb9e312a5e78712dec81b5283","造型蔬菜","造型蔬菜由中国山东省济南市帝麟舍斯食品有限公司总经理赵善言先生，经过三年努力研究与创新所创立。"
"bb5619be200958a2d36192011f0bf6fb","东台西瓜","东台西瓜以其独特的地理位置、优越的土壤条件、优良的种苗基础、丰富的种植经验形成了自有的风味特色，受到越来越多消费者的喜受，已发展成为优势产业。东台西瓜食口风味极佳。黄瓤西瓜特小凤口感细腻、多汁，是消暑解渴佳品。红瓤西瓜早春红玉糖度高、纤维少，更以其甘甜多汁、营养丰富的特点深受人们的喜爱。部分品种西瓜因皮薄肉嫩含水丰富，刀一碰即快速裂开，常以“东台爆炸瓜”享誉市场。东台西瓜获得无公害认证和国家绿色食品标志。东台西瓜先后荣获中国地理标志商标、中国名牌农产品和“2014江苏农产品和地理标志商标20强”等称号。 东台西瓜连年在全国西甜瓜擂台赛上获奖，在2015年全国西甜瓜擂台赛中，东台玉菇甜瓜在全国各地300多位选手选送的西、甜瓜品种中脱颖而出，获得甜瓜综合组冠军。"
"bb567930be8f7d88ae8e94bb819f73c3","我爱鲜花网","传情达意，我爱鲜花。“我爱鲜花网”秉承“以市场为导向，以客户为中心”的宗旨，以“打造鲜花礼仪行业优秀的鲜花速递服务商”为愿景，以强大的科技平台、卓越的管理团队、优秀的企业文化和创新的营销理念，为客户提供更加优质、快捷的服务。"
"bb6220c2f5e75fcfecc9556fef47420b","单叶紫堇","单叶紫堇（Corydalis ludlowii Stearn），罂粟科，紫堇属的一种植物。根茎长约6厘米，宽4-7毫米，分枝。产西藏东部 , 生于海拔3650米左右。"
"bb6c2828efb92fd306a26a98cbe39788","倒盆","倒盆是指将南面的植物与北边的植物颠倒位置，以满足植物对光的需求。"
"bb89e9eb5de139588a55889a7ef71e09","农民水果网","农民水果网于2013年8月16日王闫竹创立，目前由一群来自农民家庭的热爱互联网的想要为农民切实做点实事的年轻人们运营，通过分享果农、水果、农药、化肥、农具以及水果批发商、代理商、水果营养专家等方面的资源信息来帮助果农拿到更多的市场份额，改变果农利益处于底层的市场劣势，让果农信息、水果信息进入线上流通和转化。希望通过我们的努力，能让更多的果农过上富足的生活。"
"bb92b416b9511a4657d560cf41f2cafc","丽钟阁","丽钟阁又称丽钟角，为萝藦科、丽钟角属多肉植物，植株丛生，深绿色肉质茎圆柱状，高约20厘米，直径1.5厘米至2厘米，具棱10个至14个，棱上密生紫色小疣突，疣突先端有3根白色刺状硬毛，其中向下的两根呈八字形分开。花着生于嫩茎的基部，花朵钟状，花筒长9厘米至14厘米，直径4厘米至5厘米，黄绿色，具红褐色斑纹，夏秋季节开放。"
"bba224f5c44dda03a8a7dae88196c44a","《花卉无土栽培》","《花卉无土栽培》的作者是王华芳。ISBN是9787508204437。出版社是金盾出版社。出版年是2001-09-01。"
"bbb8b7d52c992025c90aadbb38d209f6","滇刺榄","滇刺榄属常绿乔木，高6-15米，有乳汁；小枝有棱角。叶互生，疏散，薄革质，披针形至矩圆形，长5-18厘米，宽2-5厘米，顶端渐尖，上面稍光亮，侧脉15-17对；叶柄被绒毛。花数朵簇生叶腋，有时单生，5数；萼二面被毛；花冠裂片披针形，长6.5毫米；花丝基部有2束长毛，药隔尖而凸，退化雄蕊卵状披针形，顶端尾状长尖，缘毛甚密。果核果状，近卵形，长约1.5厘米，黄色，被锈色绢毛或柔毛，宿存花柱细长。 产云南南部。生海拔1400-1600米密林中，较常见。"
"bbbaf6b36058cacc6e43873a07b70b45","高山反季节蔬菜","我国长江流域以南各地夏季炎热，月平均温度常在28℃以上，最高达35℃以上，许多喜温而不耐热的蔬菜和喜冷凉的秋冬菜在七、八月间均不能正常生长，致使7-9月蔬菜市场供应不足，出现菜价高，花色品种少的淡季。而高山气候比平原凉爽，常与平原、丘陵地区形成一个明显的季节差，利用这个气候差异，再选择运销对路、耐热、耐早、抗病、耐贮运的强势品种，合理安排茬口，使采收期安排在7-9月间，则可获得最大的社会及经济效益，是改善平原地区夏季蔬菜淡季的供应、使山区农民无须背井离乡打工就可致富的一条重要渠道。"
"bbbf0725a25948885cdf10f9af801549","丹东杜鹃","丹东杜鹃，辽宁省丹东市特产，全国农产品地理标志。 丹东地处中纬度地区，四季分明，属暖温带大陆性季风湿润气候。冬季时间最长，夏季次之，春秋过渡季节最短，适宜种植杜鹃。丹东杜鹃栽培历史悠久。二十世纪三十年代，丹东就有盆栽杜鹃，到东北解放时，已经形成了丹东杜鹃的老八种。丹东杜鹃一年四季都生机勃勃，花大色艳，品种繁多，花期长达数月，花朵密密层层，茂盛，叶片常年绿嫩，衬托各色花朵，美不胜收，是国事活动花卉。 2008年8月22日，原中华人民共和国农业部正式批准对“丹东杜鹃”实施农产品地理标志登记保护。"
"bbc533c6a0522e9aeb3a6f622ec5305e","金魁猕猴桃","金魁猕猴桃，是湖北省农业科学院果树茶叶研究所从湖北竹溪县野生猕猴桃优株‘竹溪2号’的种子播种后代中选育而成，1993年通过省级品种审定。于1988年和1992年连续两年获农业部优质农产品中心评比第一名。果实披毛，棕褐色，阔椭圆形或圆柱形，平均果重100克以上，果肉翠绿色，汁液多，风味特浓，甜酸可口，芳香，品质极上。每百克果肉中含维生素C110~240mg，含可溶性固形物18%~26%。"
"bbcd490dc7067cfbaf7b4602c88bd2c0","八瓜","八瓜是指冬瓜、西瓜、南瓜、北瓜、黄瓜、丝瓜、苦瓜、甜瓜8种瓜。"
"bbcfb7352d2de4dc895507ef4736869d","黑香芒果","黑香芒果是台湾特产，吃起来有淡淡的龙眼香味。但深绿色的表皮，常让消费者误为尚未成熟而退避三舍。"
"bbd20623a46fd738267ce94e1b51a870","sGK棉乡69","sGK棉乡69是新乡市锦科棉花研究所选育的双价转基因抗虫常规春棉品种，生育期121天。结铃性强，铃卵圆形中等大小，铃壳较薄；吐絮畅而集中，易收摘。"
"bbd84080afcb585da202191a1eee078d","疏花木犀榄","疏花木犀榄，学名Olea laxiflora Li ，木犀科木犀榄属植物。产于云南。"
"bbeeaf725883eb1f29641093791b0aed","柴胡属","Bupleurum L. 柴胡属，伞形科，分布于北半球的亚热带地区，我国有36种，17变种，主产西北与西南高原地区，其他地区种类较少。一、二年生或多年生草本；单叶全缘最下部叶常呈禾叶状，茎生叶基部渐狭或心形而抱茎；复伞形花序；总苞和小总苞的苞片呈叶状而宿存，或狭而少数，很少缺乏；萼齿退废；花瓣近圆。形或棱形，背部有突起的中脉；花柱基平坦，全缘，花柱短，果侧面压扁，合生面稍收缩；心皮五角形，主棱明显或扩大成翅，或极纤细或不明显，棱槽内油管1－3（6），合生面2－4（6），较细或全部不明显。"
"bbefcf5b550fcb310aca901abdb7fd58","桂蹄2号","桂蹄2号，荸荠品种，该品种在生产上有较大的应用价值，通过审定，可在全区桂林、贺州、柳州马蹄种植区种植。"
"bbf754d2269a214998313d375d0790f4","速冻芋头","把芋头去皮，漂烫、包装、速冻之后成为速冻芋头。"
"bc09e866f235a86dee99ebc8916cb3fe","复色绿莲瓣","复色绿莲瓣，通称绿莲瓣。复色即多色，绿头瓣为兰中仅见，属莲瓣珍品。宋朝大诗人宋·苏轼曾作诗赞颂。引语赏评：春兰如美人，不采羞自献。时闻风露香，莲艾深不见。"
"bc220257a249d362ddeebb219f04eba3","西藏红葱","西藏红葱也叫藏葱、楼子葱。在西藏自治区的拉萨、日喀则，南木林和萨嘎等地均有栽培。株高60～75厘米，株丛叶展40～60厘米，管状叶中等粗细，深绿色，有蜡粉；叶鞘部分长约30厘米，粗1～1. 5厘米，不膨大生长，外皮半革质、红褐色，内部鳞片白色。每株可发生分蘖5～8个，每个分蘖着生管状叶4～8枚。在西藏地区6～7月份抽薹，顶部着生气生鳞茎10～16个，并间有小花，但不结籽，也有花薹重叠呈楼层状的特性。西藏红葱抗寒、耐旱、耐热，适应性极强，可以安全越冬。在拉萨和日喀则地区6～7月间采集气生鳞茎育苗，第二年3月下旬至4月上旬定植，在6月中下旬至11月上旬可陆续采收。每666．7平方米可产1000～1500千克，是生物学植物系统分类中被子植物门下一个的物种名称。"
"bc27c63b0484326dc38232ae81e1a942","铁山杨梅","铁山杨梅，江西省上饶县特产，全国农产品地理标志。冷水江市铁山村素有杨梅之乡之称，铁山杨梅种类繁多。大的有核桃般大，肉厚核小，分乌白两种。乌梅水份饱满，溢于外表，用手轻轻一拈，即能印上指印，落口即消融，甜中微酸，沁人心脾；白梅呈乳白状，且透明。小的称金钱梅，有大红、紫红、黄、棕、麻花等色，味酸肉硬，一口咬去，酸得人牙齿打颤，却是清新调味的佳品。2011年09月13日，中华人民共和国农业部批准对“铁山杨梅”实施农产品地理标志登记保护。"
"bc30e9d00f7d0752a316294b2e5a2811","瓯豇一点红","瓯豇一点红--由温州市农科院蔬菜研究所选育，以主蔓结荚为主，主蔓5节左右着生第一花序。中熟偏早，播种到始收，春播约70天，夏播约40天。"
"bc33b1dfa27ccd5e2b18d79e15bc5fd3","曲边线蕨","曲边线蕨为水龙骨科线蕨属植物，株高30～50厘米。根状茎横走，密生褐色鳞片，叶柄两侧有阔翅，叶片较宽，羽状深裂，边缘为波浪形叶纸质。孢子囊群线形着生在小裂片背面的主脉基部。"
"bc4495a69ca351fe02fcdedfadf7b5de","临海杨梅","临海杨梅，浙江省临海市特产，中国国家地理标志产品。临海是浙江省最大的杨梅生产基地县之一，栽培杨梅面积达11万亩，年产量4万吨，产值近2亿元，是临海市水果业中仅次于柑橘的第二大产业。临海早大梅是临海本地水梅的变异良种，早熟、果形大、耐贮藏、品质优。临海东魁杨梅果形特大、色泽艳丽、酸甜适口、风味浓郁。2003年临海市白水洋上游杨梅产业合作社生产的“上游”牌东魁杨梅获“浙江省十大精品杨梅”，2005年被评为省级农业名牌产品。临海杨梅种植面积超万亩的镇有3个，白水洋镇还被授予“浙江杨梅之乡”称号。"
"bc4d695e6a63df06b954d2bc92d7c77e","半蒴苣苔属","多年生草本，茎单生或分枝。成对的叶少数到多数，沿茎，对生，等长到近等长；具柔毛的叶片无毛到，基部渐狭到楔形，很少圆形。花序伞形花序象一样，紧密，或假顶生，1到多花的聚伞花序；苞片2，相反，，形成球状到卵球形总苞，是生物学植物系统分类中唇形目下一个的物种名称。"
"bc600337c945471191f445a3c10948d9","合欢","合欢（Albizia julibrissin Durazz.）， 又名绒花树，马缨花。落叶乔木，夏季开花，头状花序，合瓣花冠，雄蕊多条，淡红色。荚果条形，扁平，不裂。高4-15米。树冠开展；小枝有棱角，嫩枝、花序和叶轴被绒毛或短柔毛。托叶线状披针形；头状花序于枝顶排成圆锥花序；花粉红色；花萼管状，花期6-7月；果期8-10月。喜光，耐干燥瘠薄。木材红褐色，纹理直，结构细，干燥时易裂，可制家具、枕木等。树皮可提制栲胶。原产中国、日本、韩国、朝鲜。为威海市市树。"
"bc6971ba1aec202fbf576eb6a70cf83a","新西兰原生雪草","新西兰原生雪草，是雪花莲的一种。本属植物是春天最早开花的球根花卉。花色白，原产于新西兰南岛，最佳种植期在冬天与早春交接时。新西兰雪草是一年中开的最早的花，当她开放时，春天的脚步也就到了。"
"bc81c7d30d42c0ba5210ff50f5c6d367","清徐葡萄","清徐葡萄，山西省太原市清徐县特产，全国农产品地理标志。清徐县属于温带大陆性气候区，气候温和，四季分明，年平均气温10.2-10.6℃，年均降水量500毫米左右，适宜种植葡萄。清徐葡萄有龙眼、黑鸡心、瓶儿、牛奶、驴奶、西营葡萄、白玛瑙、黑玛瑙、紫玫瑰、白鸡心等品种，引入的品种有粉红太妃、卡拉斯玫瑰、保尔加尔、葡萄园皇后、玫瑰香、无核黑、巨峰、零丹等。清徐葡萄，皮薄、粒大、色泽美观。肉厚、糖分高、味道甜。果肉柔软多汁。2013年04月15日，原中华人民共和国农业部正式批准对“清徐葡萄”实施农产品地理标志登记保护。"
"bc912592ae551ebb56b3981d3720a19c","干辣椒","干辣椒是红辣椒经过自然晾晒、人工脱水等过程而形成的辣椒产品，又称作辣椒干、干制辣椒，制干辣椒、加工辣椒、加工型辣椒等。它的特点是含水量低、适合长期保藏，但未密封包装或含水量高的干辣椒容易霉变。干辣椒的吃法主要是作为调味料食用。阴虚火旺及患咳嗽、目疾者忌服干辣椒。"
"bc94d7e032318fec3cf9141fd731e7e3","盘山盖柿","盘山盖柿又名盖柿、盘山柿子，原产天津、栽培历史悠久，是当地的古老栽培树种之一。柿果个大、皮薄、汤清、甘甜，尤以盘山地区最为著名。盘山盖柿无核，每百克鲜柿果肉中含糖12－18克，蛋白质1．2克，脂肪0．2克，可溶性固形物15－18克。"
"bcb2bfe4d240082e79341c50f2ae2476","南果梨","南果梨属辽南特产，主产地为辽宁省鞍山市、北镇市，需要特有的富铁土壤才能孕育出的独特水果品种，该果海城市、北镇市产量较高，属华夏果中之桂冠。该梨以其色泽鲜艳、果肉细腻、爽口多汁、风味香浓而深受国内外友人赞誉，素有“梨中之王”美誉。是不可多得的能与新疆库尔勒香梨、山西贡梨以及原产于日本的水晶梨等诸多梨中珍品相媲美的稀有梨种。 南果梨属秋子梨，故其采摘期在每年的九月初，此时果实一般纵径为4.7～5.2厘米，横径为5.5～5.8厘米。平均单果重50～75克左右，最大单果重可达170克。刚采摘下的果实需经一至两周时间的后贮，方能把果实的色泽、口感、气味充分显露出来。 南果梨是世界梨果中的珍稀品种，在《中国果树志第三卷》介绍的梨果中，南果梨名列首位。它以其独特的香气被中国农科院果树研究所对全国517个梨种评定品质极上的四个梨种之一。"
"bcf1388b4aae6b7b42091fefb1485623","胜台村","胜台村--位于素有辽南葡萄第一镇之称的红旗镇东部，原名胜台村，又名三台子、胜利村，目前住户有1300多户，现辖3个村庄，丁山堡和八家子的一部分，本村以大棚葡萄、桃子和陆地葡萄等水果为主。"
"bd00d1753051462f0407dcf34139a31d","油潭本龙眼","油潭本龙眼，简称油潭本，为龙眼的一个品种。该品种原种出自福建省莆田市华亭镇油潭村，栽培历史一百七十年以上。果实于9月中旬成熟，为中熟（偏迟）品种。该品种果实焙干率高（40%），焙后壳不凹陷，亦不易破裂，为制桂圆干良种。"
"bd24cc7f97d31a49255b834b2e9a1036","刺梨","刺梨，中药材名。本品为蔷薇科植物刺梨的果实。功能主治为：健胃，消食。治食积饱胀。①《贵州民间方药集》：健胃，消食积饱胀，并滋补强壮。②《四川中药志》：解暑，消食。"
"bd2e833004402dbe9138fef6370c864e","早熟禾-印地安酋长","早熟禾--印第安酋长是目前世界上惟一注册并受法律保护的极具利用价值的加拿大早熟禾品种。"
"bd3e59bafa16114d206881fe21a0fd62","高大沟酸浆","高大沟酸浆属玄参科，国内分布于川,滇。海拔：200-3800 米。"
"bd466756212eb2737dc12d5fc3e5f523","云南杓兰","云南杓兰（学名：Cypripedium yunnanense Franch.）：植株高20-37厘米，具粗短的根状茎。茎直立，无毛或在上部近节处疏被短柔毛，基部具数枚鞘，鞘上方具3-4枚叶。叶片椭圆形或椭圆状披针形。花序顶生，具1花；花略小，粉红色、淡紫红色或偶见灰白色，有深色的脉纹，退化雄蕊白色并在中央具1条紫条纹；花瓣披针形，长2.2-3.2厘米，宽7-8毫米，先端渐尖，稍扭转或不扭转，内表面基部具毛；唇瓣深囊状，椭圆形。花期5月。生于海拔2700-3800米的松林下、灌丛中或草坡上。产中国四川西部至西南部、云南西北部和西藏东南部。此花有栽培，具有较高的园艺价值。（概述图片参考资料来源： ）"
"bd4af69c11a70634198ef0f62887576f","东川小檗","东川小檗（学名：Berberis dongchuanensis）是小檗科、小檗属的一种常绿灌木，为中国的特有植物。分布在中国大陆的云南等地，生长于海拔2,600米的地区，常生于崖脚，目前尚未由人工引种栽培。"
"bd635793997e3e9e10892f172d2f9896","大紫","大紫(Black Tartarian)又名大叶子、大红袍、大红樱桃。原产于俄罗斯，1890年引入山东烟台，是目前我国的主栽品种之一。"
"bd6360f78847a027a528d2124078275b","《花卉应用与设计》","《花卉应用与设计》是由吴涤新编写，中国农业出版社于1999年出版的图书。是论述室内外花卉应用与设计的专论性著述。"
"bd80c987be598e74361d872fd3bf4ee6","三花灯心草","三花灯心草，灯芯草目灯心草科植物，高5-20厘米，茎丛生，细长，圆柱形或具棱角。生于高山潮湿地。"
"bd8cbc1cc3f376264d8fa81d4fda9b80","套耕","套耕，就是在耕地的时候，在第一张犁的后面再跟一张犁，第二张犁顺着第一张犁犁出来的沟再犁一次，这样有助于耕的地更深。"
"bd9224985bb357b093b9cc47f36b002d","中油5628","双低杂交油菜新品种“中油5628”是中国农业科学院油料作物研究所著名育种专家邹崇顺研究员领导的课题组，利用分子标记结合聚合杂交和轮回选择等先进育种技术选育而成的。"
"bdb2b4c6682b317ae8bd4d3b8c7208f7","水晶什锦芒果粒","什锦芒果粒是一种凝胶蜜饯制品。"
"bdbf6299a8f63438dd7eee4e01ab9c74","速冻辣椒","选用绿色或红色的新鲜辣椒做原料，辣椒要色泽光亮、肉厚、辣、无病虫害、无斑点。"
"bdc4ae24dfcdcd0b387b1dc2de8b3d37","光花鹅观草","光花鹅观草（学名：Roegneria leiantha）为禾本科鹅观草属下的一个种。特产青海。"
"bdcd96f65954f71e7a3870385f534253","塑料大棚","塑料大棚俗称冷棚，是一种简易实用的保护地栽培设施，由于其建造容易、使用方便、投资较少，随着塑料工业的发展，被世界各国普遍采用。 利用竹木、钢材等材料，并覆盖塑料薄膜，搭成拱形棚，供栽培蔬菜，能够提早或延迟供应，提高单位面积产量，有利于防御自然灾害，特别是北方地区能在早春和晚秋淡季供应鲜嫩蔬菜。"
"bdd7cf2a0fec6fda9f530d35d398b0b4","大魁荷","(春兰名品)外三瓣短阔，收根放角，蚌壳捧，大刘海舌。花葶高，色不净绿。叶似同荷。"
"bdd9dc9dfc83a35837e13e9164e7678d","北京75号","北京75号，是北京市农林科学院蔬菜研究中心用782181和夏2两个自交不亲和系配制而成的杂交种。适于北京市郊区秋季种植。"
"bddab701143fa9d4b21164f38cdf6dfa","轮作","轮作是用地养地相结合的一种措施，不仅有利于均衡利用土壤养分和防治病、虫、草害，还能有效地改善土壤的理化性状，调节土壤肥力。最终达到增产增收的目的。"
"bdfb9262269d64a1b4847bb2da479e2f","厚皮甜瓜","是一种典型的藤蔓类草本植物，最早于4000多年前在波斯和非洲栽培。其果实形状像足球一样，黄皮绿肉，果肉甜而多汁，为水果的一种。果皮金黄色，比一般黄皮品种早上色约10天左右。"
"be0e528475eb581d82cee071eb63cc4a","内乡油桃沟","油桃沟位，东、北、西三面环山，属亚热带向暖温带过渡地带，气候温和，光照充足，雨量适中，自然条件得天独厚，是油桃的最佳适生区。"
"be17c15111b4bf9fc6e436751a0d67e7","南国玉属","南国玉属是仙人掌科中的小球种，易开花，花期长花色多。"
"be1874e174dc987c20fee0722fff08af","三点金","三点金（学名：Desmodium triflorum (L.) DC.），是一种豆科、山蚂蝗属的药用植物，作为医药。又名三点金草、三脚虎、六月雪、纱帽草、斑鸠窝、品字草、三点桃、哮灵草等。 三点金能够行气止痛，温经散寒，解毒。用于中暑腹痛，疝气痛，月经不调，痛经，产后关节痛，狂犬病。"
"be2b7b5b53ff99bd43cb3ced1c06721a","转基因苹果","目前，在苹果上已经获得了抗虫转基因植株，所使用的抗虫基因主要有bt(bacillus thypsin inhibitor)和cpti基因。bt基因是从苏云金杆菌分离出来的杀虫结晶蛋白(icp)基因。国外早在1991年就成功应用icp基因转化苹果，1992美国批准将携带由icp基因的转基因苹果植株进行田间试验;国内程家胜等也应用bt基因成功获得了转基因苹果植株，并进行了抗虫试验。cpt i对许多害虫都具有抗性，广谱性是其最主要的优点。国外利用cpt i基因于1992年成功转化了绿袖苹果;国内达克东等也应用cpt i基因转化了皇家嘎拉，southem杂交证明目的基因存在于苹果基因组中。苹果抗病转基因研究集中在抗火疫病(erwina amylovoea)方面，主要应用有attacine、cecropinsb-37、cecropm shiva-1等基因。norelli等用编码裂解细菌细胞的4种基因(attacine、sb-37、shiva-1和hen white lysozyme)用农杆菌介导法转化砧木m7和皇家嘎拉获得了250个转化体系，温室和田间鉴定表明携带有attacine的转化植株对疫病有极大抗性;用attacine基因转化m7，获得的转化植株对火疫病抗性大大提高，有的甚至能降低病害50%。还有报道将shiva-1、attacine导入皇家嘎拉，但温室检测转基因植株对火疫病抗性不稳定。"
"be2e723f67ddaaa331a497016a70e94e","百花蛇舌草","白花蛇舌草又叫蛇舌草、蛇舌癀、千打捶、羊须草。为双子叶植物药茜草科植物白花蛇舌草的带根全草；为茜草科耳草属植物白花蛇舌草Hedyotis diffusa Willd.[Oldenlandia diffusa （Willd.）Roxb.]的全草。具有清热解毒利尿、活血止痛的功能。主治恶性肿瘤、阑尾炎、肝炎、支气管炎、扁桃体炎、喉炎、 泌尿系统感染、盆腔炎、附件炎等症；外用治疮疖痈肿、毒蛇咬伤。现代中医临床用于治疗胃癌、食管癌、肠癌、子宫癌、鼻咽癌等多种癌症。"
"be4b46915a4e1dedeea6db288083c66e","杨梅","杨梅，女，硕士研究生学历，四川大学艺术学院党委副书记。"
"be5bdf4e8053738c3173e4c6e0391168","斑马花","斑马花又称银脉单药花、丹尼亚单药花，因叶片上的斑纹酷似斑马身上的花纹而得名。原产南美洲的热带、亚热带地区。属多年生常绿草本植物。花簇呈金字塔形，苞片黄色，有时带有红色边缘，交互包裹着花梗。斑马花叶色斑驳可爱，花形奇特，色彩明媚灿烂。是一种既可观叶，又能赏花的优良室内盆栽花卉，宜作中、小型盆栽。"
